Business Name,Contact Name,Industry,Email,Phone,Instagram,Facebook,First Contact Date,First Contact Method (Email/DM/LinkedIn/Cold Call),Message Sent (which script was used),Response (Yes/No/Not Yet),Response Date,Response Notes,Follow Up 1 Date,Follow Up 1 Sent (Yes/No),Follow Up 2 Date,Follow Up 2 Sent (Yes/No),Follow Up 3 Date,Follow Up 3 Sent (Yes/No),Break Up Message Sent (Yes/No),Status (Cold/Warm/Hot/Demo Booked/Proposal Sent/Won/Lost),Deal Value (setup fee amount),Monthly Retainer Value,Notes,Next Action,Next Action Date
Southfield Smile Center,Dr. Melissa Grant,Dental,mgrant@southfieldsmilecenter.com,(248) 555-0141,@southfieldsmilecenter,facebook.com/southfieldsmilecenter,2026-03-03,Email,Lead Capture Angle,Yes,2026-03-04,"Interested in improving after-hours lead response. Asked for a short demo.",2026-03-06,Yes,2026-03-10,No,2026-03-14,No,No,Demo Booked,2500,400,"Strong fit for Project 1 + Project 4 bundle. Office manager copied on reply.",Send demo call reminder,2026-03-28
Evergreen Family Dental,Dr. Aaron Patel,Dental,apatel@evergreenfamilydental.com,(248) 555-0177,@evergreenfamilydental,facebook.com/evergreenfamilydental,2026-03-05,LinkedIn,Voice Agent Angle,Not Yet,,No reply after connection accepted.,2026-03-08,Yes,2026-03-12,Yes,2026-03-19,No,No,Warm,1500,300,"Likely fit for Voice Agent if phone coverage is a pain point.",Send Day 14 follow up,2026-03-29
Northwestern Dental Care,Dr. Priya Shah,Dental,info@northwesterndentalcare.com,(248) 555-0138,@northwesterndentalcare,facebook.com/northwesterndentalcare,2026-03-01,Instagram DM,Video Content Angle,Yes,2026-03-02,"Owner replied that social media is a weak point and asked for pricing.",2026-03-04,Yes,2026-03-09,Yes,2026-03-16,Yes,No,Proposal Sent,1500,300,"Good candidate for Project 7. Could expand into chat widget later.",Follow up on proposal,2026-03-30
Lahser Family Dentistry,Dr. Kevin Rhodes,Dental,frontdesk@lahserfamilydentistry.com,(248) 555-0112,@lahserfamilydentistry,facebook.com/lahserfamilydentistry,2026-02-26,Email,Lead Capture Angle,No,2026-02-27,"Office replied that they are not looking at anything new this quarter.",2026-03-03,Yes,2026-03-10,Yes,2026-03-17,Yes,Yes,Lost,500,150,"Closed-lost for now. Revisit in Q3 if timing changes.",Move to nurture list,2026-06-15
12 Mile Dental Group,Sarah Coleman,Dental,sarah@12miledentalgroup.com,(248) 555-0164,@12miledentalgroup,facebook.com/12miledentalgroup,2026-03-02,Cold Call,Voice Agent Angle,Yes,2026-03-02,"Practice manager asked for proposal after hearing missed-calls demo.",2026-03-05,Yes,2026-03-11,No,2026-03-18,No,No,Won,3500,650,"Closed on Growth package: Voice Agent + Lead Capture + Chat Widget.",Schedule kickoff call,2026-03-31
